{
    "suspended":  false,
    "channel":  "pilot",
    "release":  {
                    "version":  "2026.09.30",
                    "publishedAt":  "2026-09-30T16:57:34.1840937Z",
                    "packageUrl":  "https://github.com/AleKudo/BridgeCPOS-Releases/releases/download/v2026.09.30-pilot/BridgeCPOS-2026.09.30.zip",
                    "sha256":  "25BED1D1F838B04BD31B478DCB293952C70098DB75B21ABC40689EA531FD5134",
                    "minimumVersion":  "2026.09.11",
                    "rollbackCompatible":  true
                },
    "blockedVersions":  [

                        ]
}
