{
    "suspended":  false,
    "channel":  "stable",
    "release":  {
                    "version":  "2026.09.29",
                    "publishedAt":  "2026-09-29T18:03:21.9671935Z",
                    "packageUrl":  "https://github.com/AleKudo/BridgeCPOS-Releases/releases/download/v2026.09.21/BridgeCPOS-2026.09.29.zip",
                    "sha256":  "483B221596AA267AB293F43D9FCCA56C8B03127BEA58390FB49764B2FF128DA9",
                    "minimumVersion":  "2026.09.11",
                    "rollbackCompatible":  true
                },
    "blockedVersions":  [

                        ]
}
